{
  "schema_version": "caesar-loop/v2",
  "finding_id": "finding_example_001",
  "run_id": "example_weapon_fixture",
  "gate_id": "gate_weapon_presentation",
  "status": "open",
  "severity": "high",
  "player_impact": "The player may misread weapon state or shot feedback.",
  "observation": "Replace with a direct observation from the named scenario.",
  "evidence_ids": ["ev_example_001"],
  "next_change": "Replace with one bounded repair hypothesis.",
  "acceptance_check": "Replace with the scenario assertion that would close this finding.",
  "owner": "weapon work-unit owner",
  "retry_count": 0,
  "blocked_by": ""
}
